{
  "schemaVersion": 1,
  "role": "supporting-generator-static-checks",
  "sourceFreezeHead": "7c6936b97a54f13d1ceb3272f810cf51d28a34f1",
  "scopeBaseHead": "846e8e07614a97dcebd9d2cd2bdb678f971651fd",
  "node": "v22.22.0",
  "platform": "darwin",
  "nativeWindowsExecuted": false,
  "productRuntimeExecuted": false,
  "syntaxChecks": 2,
  "envResults": [
    {
      "arm": "E0",
      "changedKeys": [],
      "baseUnchanged": true
    },
    {
      "arm": "E1",
      "changedKeys": [
        "SystemDrive"
      ],
      "baseUnchanged": true
    },
    {
      "arm": "E2",
      "changedKeys": [
        "APPDATA"
      ],
      "baseUnchanged": true
    },
    {
      "arm": "E3",
      "changedKeys": [
        "LOCALAPPDATA"
      ],
      "baseUnchanged": true
    },
    {
      "arm": "E4",
      "changedKeys": [
        "PSModulePath"
      ],
      "baseUnchanged": true
    }
  ],
  "admissionResults": [
    {
      "name": "exact-case-reserve",
      "expected": null
    },
    {
      "name": "one-ms-short",
      "expected": "global-cleanup-output-allowance-insufficient"
    },
    {
      "name": "total-cap",
      "expected": "total-powershell-budget-insufficient"
    },
    {
      "name": "smoke-cap",
      "expected": "smoke-powershell-budget-insufficient"
    },
    {
      "name": "analog-no-budget",
      "expected": "total-powershell-budget-insufficient"
    }
  ],
  "guardMockResults": [
    {
      "mode": "normal",
      "passed": true,
      "noNativeExecution": true,
      "healthState": "complete"
    },
    {
      "mode": "native-throw",
      "passed": true,
      "noNativeExecution": true,
      "healthState": "complete"
    },
    {
      "mode": "sync-throw",
      "passed": true,
      "noNativeExecution": true,
      "healthState": "complete"
    },
    {
      "mode": "logger-stat",
      "passed": true,
      "noNativeExecution": true,
      "healthState": "failed"
    },
    {
      "mode": "logger-append",
      "passed": true,
      "noNativeExecution": true,
      "healthState": "failed"
    },
    {
      "mode": "counter-fail",
      "passed": true,
      "noNativeExecution": true,
      "healthState": "failed"
    },
    {
      "mode": "cap",
      "passed": true,
      "noNativeExecution": true,
      "healthState": "complete"
    },
    {
      "mode": "expired-active-owned-handle",
      "passed": true,
      "noNativeExecution": true,
      "healthState": "complete"
    },
    {
      "mode": "expired-already-closed",
      "passed": true,
      "noNativeExecution": true,
      "healthState": "complete"
    }
  ],
  "protocolAllowlistControlsPassed": true,
  "nativeAttributeScriptExact": true,
  "workflowOnlyApprovedCommandLabelMetadataChanged": true,
  "frozenProductTestsStateAndReportsUnchanged": true,
  "workflowActionlintPassed": true,
  "originalEvidenceHashesVerified": 32,
  "optionalCombinedArmImplemented": false,
  "proofInventory": [
    {
      "path": "src",
      "frozenGitObject": "aed0109b2f26e5f7fb6ae2c7ca2cab3a80edc68d",
      "currentCommittedGitObject": "aed0109b2f26e5f7fb6ae2c7ca2cab3a80edc68d"
    },
    {
      "path": "tests",
      "frozenGitObject": "7e8022a84dc47165b900e2d05f019477e81a2a0d",
      "currentCommittedGitObject": "7e8022a84dc47165b900e2d05f019477e81a2a0d"
    },
    {
      "path": "package.json",
      "frozenGitObject": "57b2a59283ca82575dfbc5c8410b4b127aa6c809",
      "currentCommittedGitObject": "57b2a59283ca82575dfbc5c8410b4b127aa6c809"
    },
    {
      "path": "package-lock.json",
      "frozenGitObject": "e524b93cf30dbf840aa10aab81f1cbdf7866cfd8",
      "currentCommittedGitObject": "e524b93cf30dbf840aa10aab81f1cbdf7866cfd8"
    },
    {
      "path": "progress.json",
      "frozenGitObject": "ff195b5ad13d3584d6ee8f6b459b82388ce4fddc",
      "currentCommittedGitObject": "ff195b5ad13d3584d6ee8f6b459b82388ce4fddc"
    },
    {
      "path": "features.json",
      "frozenGitObject": "918eb22c3679c2ceab23533c482c48fc38fe6b92",
      "currentCommittedGitObject": "918eb22c3679c2ceab23533c482c48fc38fe6b92"
    },
    {
      "path": ".github/workflows/deploy-vps.yml",
      "frozenGitObject": "9c2654610229eea6a52b424b73ec5d49831e82c4",
      "currentCommittedGitObject": "9c2654610229eea6a52b424b73ec5d49831e82c4"
    },
    {
      "path": "docs/test-reports/windows-release-diagnosis-20261008/native-diagnostics.mjs",
      "frozenGitObject": "dd823c6be301ae671223836be3097c9cc36b8c5d",
      "currentCommittedGitObject": "dd823c6be301ae671223836be3097c9cc36b8c5d"
    },
    {
      "path": "docs/test-reports/windows-release-diagnosis-20261008/trace-preload.mjs",
      "frozenGitObject": "d654d16301fcd9b0367c346ebc46ae383ffb2269",
      "currentCommittedGitObject": "d654d16301fcd9b0367c346ebc46ae383ffb2269"
    },
    {
      "path": "docs/test-reports/windows-release-diagnosis-20261008/native-findings-r1/original",
      "frozenGitObject": "fe2529e24933906177d0cf0b5ce4f82e044aea74",
      "currentCommittedGitObject": "fe2529e24933906177d0cf0b5ce4f82e044aea74"
    }
  ],
  "newFileHashes": {
    "native-runtime-parity.mjs": "846f9eb6363d44912de8d8506ed62a53bc6e13fab6238f08a569a13c0fa60053",
    "parity-generator-r1/checks.mjs": "070d8e4218793f78e3aab593ae7f7a39b87bd525a11ba8930c33a2b540329465"
  },
  "releaseAcceptance": false,
  "releaseReady": false
}
